[
  {
    "id": "inspection.external",
    "title": "외상 검사",
    "kind": "evidence",
    "text": "뒤통수에 상처가 있으나 두개골 골절은 확인되지 않았다. 상처에는 다친 뒤에도 심장이 뛰었던 흔적이 남아 있다. 이런 부상은 직후 대화하거나 움직인 뒤 상태가 늦게 악화될 수도 있어, 생존 증언만으로 영향을 배제할 수 없다. 보이는 상처와 출혈만으로 실제 치사 여부는 확정되지 않는다.",
    "tags": [
      "공식 검사",
      "외상",
      "상처 이후 생존"
    ]
  },
  {
    "id": "inspection.neck",
    "title": "목·기도 주변 검사",
    "kind": "evidence",
    "text": "입가와 코 주변에는 사망 전에 넓게 눌린 흔적과 여러 색의 미세한 직물 가루가 남아 있다. 목의 좁고 끊어진 압박 흔적만으로는 이 양상을 모두 설명할 수 없다. 마지막 사인은 부드러운 물체로 입과 코를 함께 막은 질식과 부합하지만, 이 검사만으로 물건의 종류나 누가 눌렀는지는 알 수 없다.",
    "tags": [
      "공식 검사",
      "압박 흔적",
      "미세 직물"
    ]
  },
  {
    "id": "inspection.toxicology",
    "title": "약물 정량 검사",
    "kind": "evidence",
    "text": "혈액에서 수면제와 벨라도나가 검출되었으나, 각각의 수치는 검시 기록지의 치사 기준선 아래에 있다. 약물을 마신 뒤 한동안 말하거나 움직였더라도 흡수가 진행되며 의식과 호흡이 늦게 악화될 수 있다. 두 약물의 복합 작용 가능성은 남지만 투여자·투여 시각·단독 치사 여부는 이 검사로 확정할 수 없다.",
    "tags": [
      "공식 검사",
      "수면제",
      "벨라도나"
    ]
  },
  {
    "id": "inspection.time",
    "title": "사망 시각 검토",
    "kind": "evidence",
    "text": "23시 5분 발견 상태만으로 사망 시각을 분 단위로 확정할 수 없다. 다만 22시 52분 호출 기록과 종줄의 혈흔이 아드리안의 직접 행동이라면 그보다 앞선 폭행과 목 압박은 최종 치명 행위가 아니다. 마지막 호출 뒤의 방문 기록과 신체 흔적을 함께 대조해야 한다.",
    "tags": [
      "공식 검사",
      "사망 시각",
      "기록 대조"
    ]
  }
]
